<?xml version="1.0" encoding="ISO-8859-1"?>
<configuration xmlns:xsi="http://www.w3.org/2001/XMLSchema-instance"
               xsi:noNamespaceSchemaLocation="callmanager.xsd">
    <callmanager
            registerbackofftimer="5000"
            registerbeforeexpirationtime="1000"
            registeredname=""
            inboundaudiomedia="pcmu"
            inboundvideomedia="h263"
            outboundcallcallingparty=""
            contacturioverride=""
            outboundcallconnecttimeout="30000"
            disconnectonsiptimeout="true">

            
            <requiredoutboundaudiomedia>
				<mediatype encoding="pcmu"></mediatype>
				<mediatype encoding="telephone-event"></mediatype>
			</requiredoutboundaudiomedia> 

            <requiredoutboundvideomedia>
				<mediatype encoding="h263"></mediatype>
			</requiredoutboundvideomedia> 

			<remoteparty>
				<ssplist>
					<address host="localhost" port="5090"/>
				</ssplist>
			</remoteparty>	

	</callmanager>
</configuration>

